18,"Archetype-based design: Sensor network programming for application experts, not just programming experts",0
19,SWATS: Wireless sensor networks for steamflood and waterflood pipeline monitoring,0
20,Deployment strategies for differentiated detection in wireless sensor networks,2
21,Exploring in-situ sensing irregularity in wireless sensor networks,4
22,Key predistribution schemes for establishing pairwise keys with a mobile sink in sensor networks,1
23,Scopes: Smart cameras object position estimation system,No PDF Found
24,Exploiting data fusion to improve the coverage of wireless sensor networks,2
25,Hierarchical distributed data classification in wireless sensor networks,1
26,EasiTia: A pervasive traffic information acquisition system based on wireless sensor networks,1
27,Vehicle classification in sensor networks using time-domain signal processing and neural networks,0
28,Watchdog: Confident event detection in heterogeneous sensor networks,No PDF Found
29,Congestion control protocol for wireless sensor networks handling prioritized heterogeneous traffic,1
30,Ultra-low power time synchronization using passive radio receivers,1
,Total,42
"
",,
Paper Title: Dynamic voltage scaling in multitier web servers with end-to-end delay control,,
Citing Paper Number,Paper Title,Over-cite Count
1,pMapper: power and migration cost aware application placement in virtualized systems,No PDF Found
2,GreenCloud: a packet-level simulator of energy-aware cloud computing data centers,1
3,GreenCloud: a new architecture for green data center,2
4,Minimizing electricity cost: optimization of distributed internet data centers in a multi-electricity-market environment,2
5,Server workload analysis for power minimization using consolidation,No PDF Found
6,Enacloud: An energy-saving application live placement approach for cloud computing environments,1
7,Power-aware dynamic placement of hpc applications,1
8, Coordinating Multiple Autonomic Managers to Achieve Specified Power-Performance Tradeoffs.,No PDF Found
9,Temperature-constrained power control for chip multiprocessors with online model estimation,3
10,Capping the brown energy consumption of internet services at low cost,0
11,Characterizing cloud federation for enhancing providers' profit,2
12,Coordinating power control and performance management for virtualized server clusters,4
13,Autonomic power and performance management for computing systems,1
14,Corollaries to Amdahl's law for energy,1
15,Power-efficient response time guarantees for virtualized enterprise servers,7
16,C-Oracle: Predictive thermal management for data centers,1
17,Greenware: Greening cloud-scale data centers to maximize the use of renewable energy,2
18,SHIP: Scalable hierarchical power control for large-scale data centers,3
19,Integrating adaptive components: An emerging challenge in performance-adaptive systems and a server farm case-study,5
20,Challenges towards elastic power management in internet data centers,2
21, Power budgeting for virtualized data centers,0
22,Exploring power-performance tradeoffs in database systems,2
23,"Managing the cost, energy consumption, and carbon footprint of internet services",0
24,A survey of the research on power management techniques for high‐performance systems,2
25,Optimized management of power and performance for virtualized heterogeneous server clusters,No PDF Found
26,A dynamic optimization model for power and performance management of virtualized clusters,0
27,Efficient power management of heterogeneous soft real-time clusters,4
28,Power optimization for dynamic configuration in heterogeneous web server clusters,2
29,Economic model of a Cloud provider operating in a federated Cloud,0
30,Co-con: Coordinated control of power and application performance for virtualized server clusters,3
,Total,51
"
",,
Paper Title: Power-aware QoS management in web servers,,
Citing Paper Number,Paper Title,Over-cite Count
1,"A survey of autonomic computing—degrees, models, and applications",0
2, Energy-Aware Server Provisioning and Load Dispatching for Connection-Intensive Internet Services.,0
3,No power struggles: Coordinated multi-level power management for the data center,0
4,Real time scheduling theory: A historical perspective,No PDF Found
5,Managing server energy and operational costs in hosting centers,3
6,Static-priority scheduling on multiprocessors,No PDF Found
7,Dynamic voltage scaling in multitier web servers with end-to-end delay control,1
8,Server-level power control,0
9,Multi-objective virtual machine placement in virtualized data center environments,No PDF Found
10,Just-in-time dynamic voltage scaling: Exploiting inter-node slack to save energy in mpi programs,No PDF Found
11,Cluster-level feedback power control for performance optimization,3
12,Using multiple energy gears in MPI programs on a power-scalable cluster,1
13,Energy-efficient real-time heterogeneous server clusters,2
14,"Weatherman: Automated, online and predictive thermal mapping and management for data centers",No PDF Found
15,Joint optimization of idle and cooling power in data centers while maintaining response time,1
16,Temperature-constrained power control for chip multiprocessors with online model estimation,3
17,Performance evaluation of a green scheduling algorithm for energy savings in cloud computing,No PDF Found
18,"Adaptive, transparent frequency and voltage scaling of communication phases in mpi programs",1
19,Energy-aware task allocation for rate monotonic scheduling,1
20,Analyzing the energy-time trade-off in high-performance computing applications,0
21,Bounding energy consumption in large-scale MPI programs,No PDF Found
22,Power capping: a prelude to power shifting,0
23,"[BOOK][B] Autonomic computing: concepts, infrastructure, and applications",0
24,Exploring the energy-time tradeoff in mpi programs on a power-scalable cluster,1
25,Coordinating power control and performance management for virtualized server clusters,4
26,Boosting data center performance through non-uniform power allocation,1
27,Autonomic power and performance management for computing systems,1
28,Risk-aware limited lookahead control for dynamic resource provisioning in enterprise computing systems,1
29,Power-efficient response time guarantees for virtualized enterprise servers,7
30,Maximizing cloud providers' revenues via energy aware allocation policies,1
,Total,32
"
",,
Paper Title: Web server QoS management by adaptive content delivery,,
Citing Paper Number,Paper Title,Over-cite Count
1,[BOOK][B] Feedback control of computing systems,0
2,Performance guarantees for web server end-systems: A control-theoretical approach,10
3,"Feedback control real-time scheduling: Framework, modeling, and algorithms",No PDF Found
4,Integrating user-perceived quality into web server design,No PDF Found
5,Quality is in the eye of the beholder: meeting users' requirements for Internet quality of service,1
6,Web server support for tiered services,1
7,A feedback control approach for guaranteeing relative delays in web servers,No PDF Found
8, Adaptive Overload Control for Busy Internet Servers.,No PDF Found
9," By Tarek F. Abdelzaher, John A. Stankovic, Chenyang Lu, Ronghua Zhang, and Ying Lu",11
10,Using MIMO feedback control to enforce policies for interrelated metrics with application to the Apache Web server,3
11,Characterizing the scalability of a large web-based shopping system,0
12, Aqueduct: Online Data Migration with Performance Guarantees.,4
13,Web content adaptation to improve server overload behavior,1
14,Integrated resource management for cluster-based internet services,No PDF Found
15,Performance specifications and metrics for adaptive real-time systems,No PDF Found
16,Feedback control architecture and design methodology for service delay guarantees in web servers,6
17,Feedback control scheduling in distributed real-time systems,7
18,Controlware: A middleware architecture for feedback control of software performance,10
19,Feedback control with queueing-theoretic prediction for relative delay guarantees in web servers,12
20, Kernel Mechanisms for Service Differentiation in Overloaded Web Servers.,No PDF Found
21,Differentiated caching services; a control-theoretical approach,3
22,An adaptive control framework for qos guarantees and its application to differentiated caching,9
23,An admission control scheme for predictable server response time for web accesses,1
24,Modeling and performance control of internet servers,5
25,Self-managing systems: A control theory foundation,No PDF Found
26,A QoS-sensitive approach for timeliness and freshness guarantees in real-time databases,No PDF Found
27,A control theory foundation for self-managing computing systems,5
28,Application-level differentiated multimedia Web services using quality aware transcoding,0
29,An overview of software cybernetics,4
30,Qos provisioning with qcontracts in web and multimedia servers,3
,Total,96
,,
Paper Title: Achieving real-time target tracking usingwireless sensor networks,,
Citing Paper Number,Paper Title,Over-cite Count
1,Real-time power-aware routing in sensor networks,No PDF Found
2,QoS-aware MAC protocols for wireless sensor networks: A survey,2
3,Real-time QoS support in wireless sensor networks: a survey,6
4,Secure data aggregation in wireless sensor network: a survey,1
5,Sparse target counting and localization in sensor networks based on compressive sensing,1
6,Smart sleeping policies for energy-efficient tracking in sensor networks,0
7,BorderSense: Border patrol through advanced wireless sensor networks,1
8,Sensor node lifetime analysis: Models and tools,No PDF Found
9,A comprehensive worst-case calculus for wireless sensor networks with in-network processing,2
10,On-demand time synchronization with predictable accuracy,0
11,Target enumeration via Euler characteristic integrals,No PDF Found
12,A new routing metric for satisfying both energy and delay constraints in wireless sensor networks,3
13,Towards stable network performance in wireless sensor networks,No PDF Found
14,Probability-based prediction and sleep scheduling for energy-efficient target tracking in sensor networks,3
15,Detecting movements of a target using face tracking in wireless sensor networks,1
16,A learning automata based scheduling solution to the dynamic point coverage problem in wireless sensor networks,0
17,Energy-efficient routing and secure communication in wireless sensor networks,0
18,A novel mobility management scheme for target tracking in cluster-based sensor networks,2
19,A single mobile target tracking in Voronoi-based clustered wireless sensor network,No PDF Found
20,Impact of data fusion on real-time detection in sensor networks,4
21,Theoretical treatment of target coverage in wireless sensor networks,0
22,Energy efficient sleep scheduling based on moving directions in target tracking sensor network,No PDF Found
23,A hybrid cluster-based target tracking protocol for wireless sensor networks,No PDF Found
24,Target tracking with monitor and backup sensors in wireless sensor networks,1
25,Real-time video surveillance over IEEE 802.11 mesh networks,1
26,Local area prediction-based mobile target tracking in wireless sensor networks,2
27,Distributed real-time detection and tracking of homogeneous regions in sensor networks,1
28,Fidelity-aware utilization control for cyber-physical surveillance systems,3
29,Energy efficient sleep scheduling in sensor networks for multiple target tracking,1
30, Dynamic Point Coverage Problem in Wireless Sensor Networks: A Cellular Learning Automata Approach.,No PDF Found
,Total,35
"
",,
Paper Title: Range-free localization and its impact on large scale sensor networks,,
Citing Paper Number,Paper Title,Over-cite Count
1,A survey on sensor localization,0
2,RFID localization algorithms and applications—a review,0
3,MBAL: A mobile beacon-assisted localization scheme for wireless sensor networks,No PDF Found
4,Traffic-differentiation-based modular QoS localized routing for wireless sensor networks,No PDF Found
5,Localization with a mobile beacon based on geometric constraints in wireless sensor networks,1
6,SensorFly: Controlled-mobile sensing platform for indoor emergency response applications,2
7,High accuracy localization method using AoA in sensor networks,1
8,Cost-effective barrier coverage by mobile sensor networks,1
9,A walking beacon-assisted localization in wireless sensor networks,2
10,Improved weighted centroid localization in smart ubiquitous environments,0
11,[CITATION][C] Survey of localization techniques in wireless sensor networks,No PDF Found
12,Energy-efficient capture of stochastic events under periodic network coverage and coordinated sleep,1
13,Energy-efficient capture of stochastic events by global-and local-periodic network coverage,1
14,Coverage and connectivity in duty-cycled wireless sensor networks for event monitoring,1
15,ucast: Unified connectionless multicast for energy efficient content distribution in sensor networks,4
16,Theory and practice of geographic routing,2
17,Localization of mobile users using trajectory matching,1
18,Maintaining quality of sensing with actors in wireless sensor networks,1
19,Mobility and intruder prior information improving the barrier coverage of sparse sensor networks,1
20,[BOOK][B] Indoor location tracking using received signal strength indicator,No PDF Found
21,EMD: energy-efficient P2P message dissemination in delay-tolerant wireless sensor and actor networks,1
22,Component-based localization in sparse wireless networks,2
23,Network localization using angle of arrival,No PDF Found
24, Mobility management in sensor networks,No PDF Found
25,Medium access control with mobility-adaptive mechanisms for wireless sensor networks,1
26,OTMCL: Orientation tracking-based Monte Carlo localization for mobile sensor networks,1
27,A range free localization algorithm based on restricted-area for wireless sensor networks,No PDF Found
28,At-dist: A distributed method for localization with high accuracy in sensor networks,No PDF Found
29,GPS-free directional localization via dual wireless radios,0
30,On accuracy of region based localization algorithms for wireless sensor networks,2
,Total,26
"
",,
Paper Title: GreenGPS: a participatory sensing fuel-efficient maps application,,
Citing Paper Number,Paper Title,Over-cite Count
1,A survey on privacy in mobile participatory sensing applications,2
2,SignalGuru: leveraging mobile phones for collaborative traffic signal schedule advisory,1
3,On truth discovery in social sensing: A maximum likelihood estimation approach,5
4,Optimal incentive-driven design of participatory sensing systems,1
5,Mobile computing: the next decade,No PDF Found
6,Deanonymizing mobility traces: Using social network as a side-channel,1
7, Human-centric sensing,No PDF Found
8,Integrating sensors and social networks,7
9,A scalable and elastic publish/subscribe service,No PDF Found
10,Privacy-aware regression modeling of participatory sensing data,No PDF Found
11,Quality control for real-time ubiquitous crowdsourcing,1
12,Social sensing,14
13,Leveraging smartphone cameras for collaborative road advisories,1
14,Indoor weather stations: investigating a ludic approach to environmental HCI through batch prototyping,No PDF Found
15,Ikarus: large-scale participatory sensing at high altitudes,2
16,Hiding in the mobile crowd: Locationprivacy through collaboration,1
17,Smartroad: a crowd-sourced traffic regulator detection and identification system,1
18,Exploitation of physical constraints for reliable social sensing,1
19,Using smart-phones and floor plans for indoor location tracking-Withdrawn,0
20,The sparse regression cube: A reliable modeling technique for open cyber-physical systems,1
21,Social drive: a crowdsourcing-based vehicular social networking system for green transportation,No PDF Found
22,Distance and time based node selection for probabilistic coverage in people-centric sensing,No PDF Found
23,Efficient 3g budget utilization in mobile participatory sensing applications,1
24,Crowdsensing maps of on-street parking spaces,1
25,Mutual privacy-preserving regression modeling in participatory sensing,4
26,On credibility estimation tradeoffs in assured social sensing,No PDF Found
27,Its for sustainable mobility: A survey on applications and impact assessment tools,1
28,Energy-efficient opportunistic coverage for people-centric urban sensing,0
29,A decade of wireless sensing applications: Survey and taxonomy,No PDF Found
30,Carma: towards personalized automotive tuning,1
,Total,47
"
",,
Paper Title: RID: Radio interference detection in wireless sensor networks,,
Citing Paper Number,Paper Title,Over-cite Count
1,Opportunities and challenges of wireless sensor networks in smart grid,1
2,ATPC: adaptive transmission power control for wireless sensor networks,3
3, MMSN: Multi-Frequency Media Access Control for Wireless Sensor Networks.,2
4,Realistic and efficient multi-channel communications in wireless sensor networks,2
5,Link scheduling in wireless sensor networks: distributed edge-coloring revisited,0
6,Radio link quality estimation in wireless sensor networks: a survey,0
7,Does wireless sensor network scale? A measurement study on GreenOrbs,3
8, Wireless Sensor Networks.,0
9,Developing ZigBee deployment guideline under WiFi interference for smart grid applications,0
10,A survey on jamming attacks and countermeasures in WSNs,No PDF Found
11,A measurement study of interference modeling and scheduling in low-power wireless networks,1
12,Online and remote motor energy monitoring and fault diagnostics using wireless sensor networks,1
13,Data gathering in wireless sensor networks with mobile collectors,1
14, Crowded spectrum in wireless sensor networks,2
15,Distributed time-optimal scheduling for convergecast in wireless sensor networks,No PDF Found
16,Detection of reactive jamming in sensor networks,No PDF Found
17,Multichannel superframe scheduling for IEEE 802.15. 4 industrial wireless sensor networks,2
18,Tour planning for mobile data-gathering mechanisms in wireless sensor networks,1
19,Adaptive interference-aware multi-channel clustering algorithm in a Zigbee network in the presence of WLAN interference,No PDF Found
20,TDMA-ASAP: Sensor network TDMA scheduling with adaptive slot-stealing and parallelism,No PDF Found
21,Making sensornet MAC protocols robust against interference,1
22,Dynamic conflict-free query scheduling for wireless sensor networks,1
23,Real-time query scheduling for wireless sensor networks,2
24,Resource-aware and link quality based routing metric for wireless sensor and actor networks,No PDF Found
25,Chip error pattern analysis in IEEE 802.15. 4,No PDF Found
26,RSS-based carrier sensing and interference estimation in 802.11 wireless networks,1
27,Distributed latency-energy minimization and interference avoidance in TDMA wireless sensor networks,0
28,Passive interference measurement in wireless sensor networks,1
29,Multi-channel interference measurement and modeling in low-power wireless networks,4
30,Throughput-aware routing for industrial sensor networks: Application to isa100. 11a,1
,Total,30
"
",,
Paper Title: Assignment and scheduling communicating periodic tasks in distributed real-time systems,,
Citing Paper Number,Paper Title,Over-cite Count
1,Combined task and message scheduling in distributed real-time systems,2
2,Static analysis and dynamic steering of time-dependent systems,1
3,Allocation of periodic task modules with precedence and deadline constraints in distributed real-time systems,0
4,Minimum and maximum utilization bounds for multiprocessor rate monotonic scheduling,1
5, Greedy Heuristics for Resource Allocation in Dynamic Distributed Real-Time Heterogeneous Computing Systems.,No PDF Found
6,Optimal combined task and message scheduling in distributed real-time systems,2
7,Solving a real-time allocation problem with constraint programming,2
8,Online resource management in a multiprocessor with a network-on-chip,1
9,Allocation of periodic task modules with precedence and deadline constraints in distributed real-time systems,No PDF Found
10, Multiprocessor Scheduling Using Hybrid Particle Swarm Optimization with Dynamically Varying Inertia.,1
11,An evaluation of SMT-based schedule synthesis for time-triggered multi-hop networks,No PDF Found
12,Rtsat--an optimal and efficient approach to the task allocation problem in distributed architectures,No PDF Found
13,Minimum and maximum utilization bounds for multiprocessor RM scheduling,No PDF Found
14, Dynamic task scheduling with load balancing using hybrid particle swarm optimization,1
15,Improving scalability of task allocation and scheduling in large distributed real-time systems using shared buffers,1
16,A metric and mixed-integer-programming-based approach for resource allocation in dynamic real-time systems,1
17,"Planning and resource allocation for hard real-time, fault-tolerant plan execution",4
18,Replication and allocation of task modules in distributed real-time systems,No PDF Found
19,Data plan activation and modification,No PDF Found
20,Dynamic task scheduling with load balancing using parallel orthogonal particle swarm optimisation,No PDF Found
21,Synthesis of static communication schedules for mixed-criticality systems,No PDF Found
22,Hierarchical distributed architectures for autonomous mobile robots: a case study,No PDF Found
23,A methodology for the development of distributed real-time control applications with focus on task allocation in heterogeneous systems,1
24,A computing resource management framework for software-defined radios,1
25, Temporal analysis and scheduling of hard real-time radios running on a multi-processor,1
26,Minimising task migration and priority changes in mode transitions,1
27, Solving embedded system scheduling problems using constraint programming,No PDF Found
28,Allocating and scheduling tasks in multiple fieldbus real-time systems,No PDF Found
29,Heuristic techniques for allocating and scheduling communicating periodic tasks in distributed real-time systems,No PDF Found
30, QoS adaptation in real-time systems,0
,Total,21
"
",,
Paper Title: The liteos operating system: Towards unix-like abstractions for wireless sensor networks,,
Citing Paper Number,Paper Title,Over-cite Count
1,Programming wireless sensor networks: Fundamental concepts and state of the art,3
2, Operating systems for wireless sensor networks: A survey,No PDF Found
3, TOSThreads: thread-safe and non-invasive preemption in TinyOS.,No PDF Found
4,Declarative tracepoints: a programmable and application independent debugging system for wireless sensor networks,3
5,Dustminer: troubleshooting interactive complexity bugs in sensor networks,6
6,"Internet of things: A survey on enabling technologies, protocols, and applications",No PDF Found
7,Providing OS support for wireless sensor networks: challenges and approaches,No PDF Found
8,Lorien: a pure dynamic component-based operating system for wireless sensor networks,1
9,Real deployments of wireless sensor networks,No PDF Found
10,Virtual battery: An energy reserve abstraction for embedded sensor networks,4
11,[BOOK][B] The emerging domain of Cooperating Objects,No PDF Found
12,Type-safe updating for modular WSN software,1
13,"Senspire OS: A predictable, flexible, and efficient operating system for wireless sensor networks",0
14,"CMAC, CCM and GCM/GMAC: Advanced modes of operation of symmetric block ciphers in wireless sensor networks",1
15,Bringing pervasive embedded networks to the service cloud: A lightweight middleware approach,2
16,Dynamic linking and loading in networked embedded systems,1
17, Operating systems and network protocols for wireless sensor networks,No PDF Found
18,Enix: a lightweight dynamic operating system for tightly constrained wireless sensor platforms,No PDF Found
19,"FIT: a flexible, lightweight, and real-time scheduling system for wireless sensor platforms",0
20,A comparative study on operating system for wireless sensor networks,No PDF Found
21,TinyLTS: Efficient network-wide logging and tracing system for TinyOS,4
22, Wireless sensor network operating system design rules based on real-world deployment survey,No PDF Found
23,Wireless sensor network virtualization: A survey,1
24, Evaluation of the impact of furniture on communications performance for ubiquitous deployment of wireless sensor networks in smart homes,No PDF Found
25,Optimizing in-network aggregate queries in wireless sensor networks for energy saving,2
26,Adaptive service provisioning for enhanced energy efficiency and flexibility in wireless sensor networks,0
27,Evolution of software-defined sensor networks,No PDF Found
28,On authentication method impact upon data sampling delay in wireless sensor networks,No PDF Found
29,SenSmart: adaptive stack management for multitasking sensor networks,0
30,Community Sensor Grids: Virtualization for sharing across domains,No PDF Found
,Total,29
"
",,
Paper Title: Web content adaptation to improve server overload behavior,,
Citing Paper Number,Paper Title,Over-cite Count
1,Performance guarantees for web server end-systems: A control-theoretical approach,10
2,An analytical model for multi-tier internet services and its applications,No PDF Found
3,A method for transparent admission control and request scheduling in e-commerce web sites,3
4,Session-based admission control: A mechanism for peak load management of commercial web sites,1
5,Agile dynamic provisioning of multi-tier internet applications,0
6,Web server QoS management by adaptive content delivery,1
7,Puppeteer: Component-based Adaptation for Mobile Computing.,0
8,Web servers under overload: How scheduling can help,1
9,Controlware: A middleware architecture for feedback control of software performance,10
10,Framework for adaptive content delivery in heterogeneous network environments,0
11,Session-based overload control in qos-aware web servers,No PDF Found
12,Differentiated caching services; a control-theoretical approach,3
13,WebView materialization,No PDF Found
