19,Temperature-constrained power control for chip multiprocessors with online model estimation,3
20,An adaptive control framework for qos guarantees and its application to differentiated caching,9
21,Control techniques to eliminate voltage emergencies in high performance processors,1
22,Temperature-aware processor frequency assignment for MPSoCs using convex optimization,0
23,Power capping: a prelude to power shifting,0
24,Dynamic thermal management through task scheduling,1
25,Coordinating power control and performance management for virtualized server clusters,4
26,Control-theoretic dynamic frequency and voltage scaling for multimedia workloads,No PDF Found
27, Temperature-aware computer systems: Opportunities and challenges,1
28,Thermal memory effects modeling and compensation in RF power amplifiers and predistortion linearizers,No PDF Found
29,Power-efficient response time guarantees for virtualized enterprise servers,7
30,Recent thermal management techniques for microprocessors,0
,Total,70
"
",,
Paper Title: Towards optimal sleep scheduling in sensor networks for rare-event detection,,
Citing Paper Number,Paper Title,Over-cite Count
1,Energy conservation in wireless sensor networks: A survey,2
2,Coverage and connectivity issues in wireless sensor networks: A survey,0
3,RMAC: A routing-enhanced duty-cycle MAC protocol for wireless sensor networks,No PDF Found
4,Wakeup scheduling in wireless sensor networks,1
5,"DW-MAC: a low latency, energy efficient demand-wakeup MAC protocol for wireless sensor networks",1
6,Data forwarding in extremely low duty-cycle sensor networks with unreliable communication links,2
7,Resistor emulation approach to low-power RF energy harvesting,1
8,Lifetime maximization for connected target coverage in wireless sensor networks,No PDF Found
9,"A survey on topology control in wireless sensor networks: Taxonomy, comparative study, and open issues",2
10,Extending the lifetime of wireless sensor networks through adaptive sleep,1
11,Delay of intrusion detection in wireless sensor networks,No PDF Found
12,Sleep scheduling and lifetime maximization in sensor networks: fundamental limits and optimal solutions,No PDF Found
13,An analytical model for wireless sensor networks with sleeping nodes,0
14,Design and analysis of sensing scheduling algorithms under partial coverage for object detection in sensor networks,4
15,Communicating via fireflies: geographic routing on duty-cycled sensors,No PDF Found
16,Achieving long-term surveillance in vigilnet,6
17,[CITATION][C] A Survey on Topology issues in Wireless Sensor Network.,1
18,A theory for maximizing the lifetime of sensor networks,1
19,Achieving long-term surveillance in vigilnet,8
20,Solarstore: enhancing data reliability in solar-powered storage-centric sensor networks,No PDF Found
21,Optimal sleep-wakeup algorithms for barriers of wireless sensors,2
22,Spatiotemporal delay control for low-duty-cycle sensor networks,6
23,"Analyzing the yield of exscal, a large-scale wireless sensor network experiment",1
24,On maximizing the lifetime of wireless sensor networks using virtual backbone scheduling,No PDF Found
25,Dynamic switching-based data forwarding for low-duty-cycle wireless sensor networks,2
26,Energy-driven detection scheme with guaranteed accuracy,1
27, Sleeping coordination for comprehensive sensing using isotonic regression and domatic partitions,No PDF Found
28,Efficient multipath communication for time-critical applications in underwater acoustic sensor networks,No PDF Found
29,Spatial-temporal coverage optimization in wireless sensor networks,1
30,Piggyback CrowdSensing (PCS): energy efficient crowdsourcing of mobile sensor data by exploiting smartphone app opportunities,2
,Total,45
"
",,
Paper Title: MMSN: Multi-Frequency Media Access Control for Wireless Sensor Networks.,,
Citing Paper Number,Paper Title,Over-cite Count
1,MAC essentials for wireless sensor networks,2
2,Realistic and efficient multi-channel communications in wireless sensor networks,2
3,Y-MAC: An energy-efficient multi-channel MAC protocol for dense wireless sensor networks,1
4, Wireless Sensor Networks.,0
5,The evolution of MAC protocols in wireless sensor networks: A survey,2
6,DEEJAM: Defeating energy-efficient jamming in IEEE 802.15. 4-based wireless networks,1
7,TMMAC: An energy efficient multi-channel mac protocol for ad hoc networks,1
8, Wireless multimedia sensor networks: current trends and future directions,No PDF Found
9,MC-LMAC: A multi-channel MAC protocol for wireless sensor networks,2
10,Fast data collection in tree-based wireless sensor networks,No PDF Found
11,RACNet: a high-fidelity data center sensing network,3
12,Towards a classification of energy aware MAC protocols for wireless sensor networks,2
13,A practical multi-channel media access control protocol for wireless sensor networks,No PDF Found
14,Em-mac: a dynamic multichannel energy-efficient mac protocol for wireless sensor networks,1
15, Crowded spectrum in wireless sensor networks,2
16,Efficient hybrid security mechanisms for heterogeneous sensor networks,No PDF Found
17,"Cooperative asynchronous multichannel MAC: Design, analysis, and implementation",2
18,Wireless body sensor network with adaptive low-power design for biometrics and healthcare applications,1
19,HYMAC: Hybrid TDMA/FDMA medium access control protocol for wireless sensor networks,No PDF Found
20,Enhancing the data collection rate of tree-based aggregation in wireless sensor networks,1
21,Multi-channel scheduling algorithms for fast aggregated convergecast in sensor networks,No PDF Found
22,Multi-channel assignment in wireless sensor networks: A game theoretic approach,No PDF Found
23,Approaching the maximum 802.15. 4 multi-hop throughput,1
24,A survey on multi-channel communication in wireless sensor networks,3
25,A control theory approach to throughput optimization in multi-channel collection sensor networks,1
26,Side channel: bits over interference,1
27,Game theoretical approach for channel allocation in wireless sensor and actuator networks,1
28,TFMAC: Multi-channel MAC protocol for wireless sensor networks,1
29,Flow-based real-time communication in multi-channel wireless sensor networks,5
30,Multi-channel support for dense wireless sensor networking,1
,Total,37
"
",,
Paper Title: Pda: Privacy-preserving data aggregation in wireless sensor networks,,
Citing Paper Number,Paper Title,Over-cite Count
1,SDAP: A secure hop-by-hop data aggregation protocol for sensor networks,0
2,Cyber-physical systems: A new frontier,0
3,Privacy preservation in wireless sensor networks: A state-of-the-art survey,1
4,Prisense: privacy-preserving data aggregation in people-centric urban sensing systems,No PDF Found
5,Verifiable privacy-preserving range query in two-tiered sensor networks,0
6,Secure data aggregation in wireless sensor networks,0
7,iPDA: an integrity-protecting private data aggregation scheme for wireless sensor networks,2
8,Query privacy in wireless sensor networks,No PDF Found
9,Confidentiality protection for distributed sensor data aggregation,1
10,KIPDA: k-indistinguishable privacy-preserving data aggregation in wireless sensor networks,No PDF Found
11,Energy-efficient and high-accuracy secure data aggregation in wireless sensor networks,1
12,A privacy-preserving location monitoring system for wireless sensor networks,No PDF Found
13,GP^ 2S: Generic Privacy-Preservation Solutions for Approximate Aggregation of Sensor Data (concise contribution),No PDF Found
14,Integrity protecting hierarchical concealed data aggregation for wireless sensor networks,1
15,Detecting node replication attacks in wireless sensor networks: a survey,1
16,Privacy-preserving data aggregation without secure channel: Multivariate polynomial evaluation,1
17,Privacy‐preserving robust data aggregation in wireless sensor networks,1
18,A cluster-based protocol to enforce integrity and preserve privacy in data aggregation,No PDF Found
19,MDPA: multidimensional privacy‐preserving aggregation scheme for wireless sensor networks,1
20,Location privacy preservation in collaborative spectrum sensing,1
21,Secure and energy-efficient disjoint multipath routing for WSNs,1
22,Secure data aggregation in wireless sensor networks: Filtering out the attacker's impact,1
23,Distributed privacy-preserving aggregation of metering data in smart grids,2
24,A robust sampling-based framework for privacy preserving OLAP,No PDF Found
25,A security framework for privacy-preserving data aggregation in wireless sensor networks,No PDF Found
26,High energy‐efficient and privacy‐preserving secure data aggregation for wireless sensor networks,2
27,Providing source location privacy in wireless sensor networks: a survey,0
28,Location privacy and resilience in wireless sensor networks querying,0
29,Exact in-network aggregation with integrity and confidentiality,1
30,Reconciling privacy preservation and intrusion detection in sensory data aggregation,1
,Total,19
,,
Paper Title: Real-time power-aware routing in sensor networks,,
Citing Paper Number,Paper Title,Over-cite Count
1,ATPC: adaptive transmission power control for wireless sensor networks,3
2,Rendezvous design algorithms for wireless sensor networks with a mobile base station,3
3,A survey on energy-efficient routing techniques with QoS assurances for wireless multimedia sensor networks,3
4,Transmission power control in body area sensor networks for healthcare monitoring,1
5,Real-time QoS support in wireless sensor networks: a survey,6
6,Bounded relay hop mobile data gathering in wireless sensor networks,1
7,Enhancing real-time delivery in wireless sensor networks with two-hop information,4
8,Enhancing real-time delivery of gradient routing for industrial wireless sensor networks,2
9,Energy efficient scheduling for cluster-tree Wireless Sensor Networks with time-bounded data flows: application to IEEE 802.15. 4/ZigBee,2
10,Traffic-differentiation-based modular QoS localized routing for wireless sensor networks,No PDF Found
11,Low latency and energy efficient routing protocols for wireless sensor networks,No PDF Found
12, A fuzzy approach to energy optimized routing for wireless sensor networks.,No PDF Found
13,Flow-based real-time communication in multi-channel wireless sensor networks,5
14,A new routing metric for satisfying both energy and delay constraints in wireless sensor networks,3
15,Efficient rendezvous algorithms for mobility-enabled wireless sensor networks,3
16,Minimum power configuration for wireless communication in sensor networks,0
17,Mobile cellular networks and wireless sensor networks: toward convergence,0
18,Towards stable network performance in wireless sensor networks,No PDF Found
19,An adaptive approach to topology management in large and dense real-time wireless sensor networks,3
20,A progressive approach to reducing data collection latency in wireless sensor networks with mobile elements,0
21,"FT-SPEED: A fault-tolerant, real-time routing protocol for wireless sensor networks",No PDF Found
22, A survey of routing protocols in wireless body sensor networks,No PDF Found
23, An emergency-adaptive routing scheme for wireless sensor networks for building fire hazard monitoring,No PDF Found
24,QoSNET: An integrated QoS network for routing protocols in large scale wireless sensor networks,2
25,Dimensioning and worst-case analysis of cluster-tree sensor networks,5
26,Overview of data routing approaches for wireless sensor networks,1
27,Optimal sampling rate assignment with dynamic route selection for real-time wireless sensor networks,2
28,AsOR: an energy efficient multi-hop opportunistic routing protocol for wireless sensor networks over Rayleigh fading channels,1
29, A survey of transmission power control in wireless sensor networks,1
30,Wireless sensor networks applications and routing protocols: survey and research challenges,No PDF Found
,Total,51
,,
Paper Title: A spatiotemporal communication protocol for wireless sensor networks,,
Citing Paper Number,Paper Title,Over-cite Count
1,A survey on wireless multimedia sensor networks,1
2,Rendezvous design algorithms for wireless sensor networks with a mobile base station,3
3, Wireless Sensor Networks.,0
4, Wireless multimedia sensor networks: current trends and future directions,No PDF Found
5,Research directions for the internet of things,No PDF Found
6,Enhancing real-time delivery in wireless sensor networks with two-hop information,4
7,Enhancing real-time delivery of gradient routing for industrial wireless sensor networks,2
8,Localized network layer protocols in wireless sensor networks based on optimizing cost over progress ratio,0
9,Energy efficient scheduling for cluster-tree Wireless Sensor Networks with time-bounded data flows: application to IEEE 802.15. 4/ZigBee,2
10,Traffic-differentiation-based modular QoS localized routing for wireless sensor networks,No PDF Found
11, Efficient multi-path protocol for wireless sensor networks,2
12,Identification-free batch authentication for RFID tags,1
13,Efficient rendezvous algorithms for mobility-enabled wireless sensor networks,3
14,JiTS: Just-in-time scheduling for real-time sensor data dissemination,3
15, Cross-layer QoS-aware communication for ultra wide band wireless multimedia sensor networks,1
16,A modeling for hole problem in wireless sensor networks,No PDF Found
17,Exploiting ubiquitous data collection for mobile users in wireless sensor networks,1
18,Reliable data delivery in large-scale low-power sensor networks,No PDF Found
19,Efficient hole detour scheme for geographic routing in wireless sensor networks,No PDF Found
20, An energy-efficient and high-quality video transmission architecture in wireless video-based sensor networks,No PDF Found
21,Dimensioning and worst-case analysis of cluster-tree sensor networks,5
22,Sink location service for geographic routing in wireless sensor networks,No PDF Found
23,Cross-layer quality of service support for UWB wireless multimedia sensor networks,1
24,Wireless sensor networks applications and routing protocols: survey and research challenges,No PDF Found
25,A novel routing protocol in wireless sensor networks based on ant colony optimization,No PDF Found
26,Efficient algorithm for prolonging network lifetime of wireless sensor networks,No PDF Found
27,Energy-efficient transmission scheme of JPEG images over visual sensor networks,No PDF Found
28,Data gathering mechanism with local sink in geographic routing for wireless sensor networks,2
29,Energy-efficient data dissemination protocol for detouring routing holes in wireless sensor networks,No PDF Found
30,Delay-constrained high throughput protocol for multi-path transmission over wireless multimedia sensor networks,2
,Total,33
"
",,
Paper Title: AIDA: Adaptive application-independent data aggregation in wireless sensor networks,,
Citing Paper Number,Paper Title,Over-cite Count
1,[BOOK][B] Protocols and architectures for wireless sensor networks,No PDF Found
2,Energy-efficient surveillance system using wireless sensor networks,4
3,Data aggregation techniques in sensor networks: A survey,1
4,Differentiated surveillance for sensor networks,5
5,Lessons from a sensor network expedition,1
6,In-network aggregation techniques for wireless sensor networks: a survey,3
7,VigilNet: An integrated sensor network system for energy-efficient surveillance,5
8,"Information fusion for wireless sensor networks: Methods, models, and classifications",No PDF Found
9,Minimum-energy asynchronous dissemination to mobile sinks in wireless sensor networks,3
10,A unifying link abstraction for wireless sensor networks,No PDF Found
11,Environmental wireless sensor networks,0
12,Siphon: overload traffic management using multi-radio virtual sinks in sensor networks,No PDF Found
13,Achieving real-time target tracking usingwireless sensor networks,9
14,Opportunistic flooding in low-duty-cycle wireless sensor networks with unreliable links,2
15,Analysis of wireless sensor networks for habitat monitoring,1
16,An experimental study of routing and data aggregation in sensor networks,1
17,The impact of data aggregation on the performance of wireless sensor networks,1
18,Fault-tolerant wireless sensor network routing protocols for the supervision of context-aware physical environments,1
19,Achieving long-term surveillance in vigilnet,6
20,Feedback control of data aggregation in sensor networks,3
21,Adaptive data aggregation scheme in clustered wireless sensor networks,2
22,Achieving long-term surveillance in vigilnet,8
23,Optimized scheduling for data aggregation in wireless sensor networks,No PDF Found
24,Overload traffic management for sensor networks,1
25,Spatiotemporal delay control for low-duty-cycle sensor networks,6
26,A novel agent-based simulation framework for sensing in complex adaptive environments,0
27,Optimal policies for distributed data aggregation in wireless sensor networks,1
28, Data aggregation techniques in sensor networks,1
29,DPLC: Dynamic packet length control in wireless sensor networks,No PDF Found
30, Efficient aggregation of delay-constrained data in wireless sensor networks.,1
,Total,66
"
",,
Paper Title: Envirotrack: Towards an environmental computing paradigm for distributed sensor networks,,
Citing Paper Number,Paper Title,Over-cite Count
1,[BOOK][B] Protocols and architectures for wireless sensor networks,No PDF Found
2,[BOOK][B] Fundamentals of wireless sensor networks: theory and practice,1
3, Middleware: Middleware challenges and approaches for wireless sensor networks,1
4,Programming wireless sensor networks: Fundamental concepts and state of the art,3
5,Macro-programming wireless sensor networks using Kairos,1
6,Nano-rk: an energy-aware resource-centric rtos for sensor networks,5
7,Middleware for wireless sensor networks: A survey,1
8,The liteos operating system: Towards unix-like abstractions for wireless sensor networks,No PDF Found
9,Scalable logical coordinates framework for routing in wireless sensor networks,1
10,Tinylime: Bridging mobile and sensor networks through middleware,1
11,Algorithms for generic role assignment in wireless sensor networks,1
12,Programming models for sensor networks: A survey,1
13,Opportunities and obligations for physical computing systems,No PDF Found
14, Design and implementation of a sensor network system for vehicle tracking and autonomous interception.,1
15,Research challenges for wireless sensor networks,3
16,Envirosuite: An environmentally immersive programming framework for sensor networks,0
17,Programming wireless sensor networks with the TeenyLIME middleware,1
18,TeenyLIME: transiently shared tuple space middleware for wireless sensor networks,1
19,Directed flood-routing framework for wireless sensor networks,2
20,The internet of things: A survey from the data-centric perspective,1
21,Oasis: A programming framework for service-oriented sensor networks,1
22,Beyond event handlers: Programming wireless sensors with attributed state machines,No PDF Found
23,Mobile data collection in sensor networks: The TinyLime middleware,1
24,An architecture for energy management in wireless sensor networks,1
25,PDA: Passive distributed assertions for sensor networks,2
26,Organizing the aggregate,1
27,SNTS: Sensor network troubleshooting suite,No PDF Found
28,Distributed event localization and tracking with wireless sensors,2
29, FireFly: A time synchronized real-time sensor networking platform,5
30,Energy efficient differentiable coverage service protocols for wireless sensor networks,No PDF Found
,Total,38
"
",,
Paper Title: Mobiscopes for human spaces,,
Citing Paper Number,Paper Title,Over-cite Count
1,A survey of mobile phone sensing,1
2,"Sensing meets mobile social networks: the design, implementation and evaluation of the cenceme application",No PDF Found
3,SoundSense: scalable sound sensing for people-centric applications on mobile phones,1
4,Micro-blog: sharing and querying content through mobile phones and social participation,No PDF Found
5,Anonysense: privacy-aware people-centric sensing,1
6,Data collection in wireless sensor networks with mobile elements: A survey,1
7,EmotionSense: a mobile phones based adaptive platform for experimental social psychology research,1
8,Urban sensing: out of the woods,No PDF Found
9,PRISM: platform for remote sensing using smartphones,No PDF Found
10,CenceMe–injecting sensing presence into social networking applications,2
11,GreenGPS: a participatory sensing fuel-efficient maps application,3
12,A survey on privacy in mobile participatory sensing applications,2
13,Urban sensing systems: opportunistic or participatory?,0
14,Common sense: participatory urban sensing using a network of handheld air quality monitors,1
15,Darwin phones: the evolution of sensing and inference on mobile phones,1
16,Sell your experiences: a market mechanism based incentive for participatory sensing,No PDF Found
17,How long to wait?: predicting bus arrival time with mobile phone based participatory sensing,1
18,Prisense: privacy-preserving data aggregation in people-centric urban sensing systems,No PDF Found
19,Programming pervasive and mobile computing applications: The TOTA approach,0
20,PoolView: stream privacy for grassroots participatory sensing,No PDF Found
21,Social sensing for epidemiological behavior change,0
22,Littlerock: Enabling energy-efficient continuous sensing on mobile phones,No PDF Found
23,On truth discovery in social sensing: A maximum likelihood estimation approach,5
24,Examining micro-payments for participatory sensing data collections,No PDF Found
25,Noisespy: A real-time mobile phone platform for urban noise monitoring and mapping,No PDF Found
26,AnonySense: Opportunistic and privacy-preserving context collection,1
27,AnonySense: A system for anonymous opportunistic sensing,1
28,Enabling large-scale human activity inference on smartphones using community similarity networks (csn),1
29,Dynamic pricing incentive for participatory sensing,1
30,[BOOK][B] Data-Centric Systems and Applications,No PDF Found
,Total,24
"
",,
"Paper Title: By Tarek F. Abdelzaher, John A. Stankovic, Chenyang Lu, Ronghua Zhang, and Ying Lu",,
Citing Paper Number,Paper Title,Over-cite Count
1,Real-time communication and coordination in embedded sensor networks,6
2,Cluster-level feedback power control for performance optimization,3
3,Feedback control architecture and design methodology for service delay guarantees in web servers,6
4,Feedback utilization control in distributed real-time systems with end-to-end tasks,3
5,Coordinating power control and performance management for virtualized server clusters,4
6,Power-efficient response time guarantees for virtualized enterprise servers,7
7,An overview of software cybernetics,4
8,What does control theory bring to systems research?,3
9,DEUCON: Decentralized end-to-end utilization control for distributed real-time systems,3
10,Improved prediction for web server delay control,No PDF Found
11,A systematic survey on the design of self-adaptive software systems using control engineering approaches,No PDF Found
12,Feedback control real-time scheduling in ORB middleware,3
13,Exploring alternative approaches to implement an elasticity policy,No PDF Found
14,Modeling and control design for performance management of web servers via an LPV approach,2
15,Dynamic duty cycle control for end-to-end delay guarantees in wireless sensor networks,5
16,Co-con: Coordinated control of power and application performance for virtualized server clusters,3
17,METE: meeting end-to-end QoS in multicores through system-wide resource management,1
18,SHARP control: controlled shared cache management in chip multiprocessors,No PDF Found
19,Practical application of control theory to web services,No PDF Found
20,Rethinking the use of models in software architecture,No PDF Found
21,MIMO power control for high-density servers in an enclosure,3
22,Partic: Power-aware response time control for virtualized web servers,5
23,Hierarchical control of multiple resources in distributed real-time and embedded systems,1
24,Adaptive green hosting,1
25,Conclusions of the ARTIST2 roadmap on control of computing systems,No PDF Found
26,End-to-end utilization control in distributed real-time systems,2
27,An adaptive framework for multiprocessor real-time system,4
28,Distributed utilization control for real-time clusters with load balancing,3
29,Power-aware cpu utilization control for distributed real-time systems,2
30,[CITATION][C] Control engineering for computing systems-industry experience and research challenges,4
,Total,78
"
",,
Paper Title: Lightweight detection and classification for wireless sensor networks in realistic environments,,
Citing Paper Number,Paper Title,Over-cite Count
1,Wireless sensor network survey,No PDF Found
2,"Information fusion for wireless sensor networks: Methods, models, and classifications",No PDF Found
3,Achieving real-time target tracking usingwireless sensor networks,9
4, Wireless sensor networks for battlefield surveillance,2
5,Robust location distinction using temporal link signatures,1
6,"Tracking and coordination of multiple agents using sensor networks: system design, algorithms and experiments",1
7,Tracking mobile nodes using RF doppler shifts,1
8,Data fusion improves the coverage of wireless sensor networks,2
9,Envirosuite: An environmentally immersive programming framework for sensor networks,0
10,Towards radar-enabled sensor networks,1
11,Instrumenting wireless sensor networks for real-time surveillance,0
12,A system for distributed event detection in wireless sensor networks,No PDF Found
13,Achieving long-term surveillance in vigilnet,8
14,Enviromic: Towards cooperative storage and retrieval in audio sensor networks,1
15,Detection and tracking using particle-filter-based wireless sensor networks,2
16,Data dissemination with ring-based index for wireless sensor networks,No PDF Found
17,An efficient key distribution scheme for heterogeneous sensor networks,1
